Canonical_Source,Canonical_Provenance_URI,Origin_Lists,Alias_Names,Consolidated_Disposition,Disposition_Code,Disposition_Rationale,Best_Current_License,Best_Current_Commercial_Safe,Best_Current_Attribution_Required,Observed_License_Claims,Observed_Commercial_Safe_Claims,Observed_Attribution_Claims,Merged_Notes
OpenRefine Reconciliation API Registry,https://reconciliation-api.github.io/testbench/,deepseek;gemini_vetted,OpenRefine Reconciliation API Registry | OpenRefine Reconciliation Service,exclude,tool_registry,"OpenRefine reconciliation registry is tooling/infrastructure, not a discovery dataset.",Varies,Yes,Yes,Varies,Likely | Yes,Likely | Yes,A service that can be used to match award names to linked data URIs. || Aggregates dozens of community-maintained endpoints; excellent for locally aligning and mapping obscure regional award entities into structured formats via Docker deployments.
Perseus Digital Library,http://www.perseus.tufts.edu,deepseek,Perseus Digital Library,exclude,exclude_noncommercial_or_quarantined,Non-commercial or quarantined from commercial-safe core.,Unclear,Likely,Likely,Unclear,Likely,Likely,"A digital library of the classical world, with linked data capabilities."
Prefix.cc,https://prefix.cc,deepseek,Prefix.cc,exclude,exclude_category_error,Tooling / framework / vocabulary rather than a source row.,Unclear,Likely,Likely,Unclear,Likely,Likely,"A namespace lookup service for RDF developers, useful for resolving prefixes in award data."
RDF Translator,https://rdf-translator.appspot.com,deepseek,RDF Translator,exclude,exclude_category_error,Tooling / framework / vocabulary rather than a source row.,Unclear,Likely,Likely,Unclear,Likely,Likely,A tool for converting between different RDF serializations.
RISS Linked Data (Korea),http://data.riss.kr,deepseek,RISS Linked Data (Korea),exclude,exclude_noncommercial_or_quarantined,Non-commercial or quarantined from commercial-safe core.,Unclear,Likely,Likely,Unclear,Likely,Likely,"Linked data service from the Korea Education and Research Information Service, which includes an ""awards"" ontology."
ROAD,https://road.issn.org,deepseek,ROAD,exclude,exclude_noncommercial_or_quarantined,Non-commercial or quarantined from commercial-safe core.,Unclear,Likely,Likely,Unclear,Likely,Likely,"A directory of open access scholarly resources, with linked data capabilities."
Redalyc,https://www.redalyc.org,gemini_vetted,Redalyc,exclude,noncommercial_license,Keep out of commercial-safe core.,CC BY-NC-SA,No,Yes,CC BY-NC-SA,No,Yes,"(QUARANTINED) Major Latin American open access network. Non-Commercial license restricts SaaS inclusion, but acts as a valuable reference pool for scholarly book awards."
SPARQL Playground,https://sparql-playground.com,deepseek,SPARQL Playground,exclude,exclude_category_error,Tooling / framework / vocabulary rather than a source row.,Unclear,Likely,Likely,Unclear,Likely,Likely,A web-based SPARQL query editor and runner.
Schema.org (Award Property),https://schema.org/award,deepseek,Schema.org (Award Property),exclude,exclude_category_error,"Ontology / vocabulary / schema, not a discovery source.",CC BY-SA 4.0,Yes,Yes,CC BY-SA 4.0,Yes,Yes,The award property allows for structured markup of awards received by a creative work (like a book) directly on web pages.
SciELO Books,https://books.scielo.org,gemini_vetted,SciELO Books,exclude,noncommercial_or_mixed_license,Keep out of commercial-safe core.,CC BY-NC-SA / varies,No,Yes,CC BY-NC-SA (Varies),No,Yes,"(QUARANTINED) Major open access book network for Brazil and Latin America; non-commercial license restricts some SaaS integrations, but vital for regional academic prize tracking."
Share Family,https://share-vde.org,deepseek;seed,Share Family,exclude,exclude_quarantined_seed,Carried forward from seed as quarantined pending clear license confirmation.,Unclear (QUARANTINED),No,Yes,Unclear (QUARANTINED),No,Yes,Hold out of main pool until clear-cut license confirmed.
Swissbib,https://www.swissbib.ch,deepseek,Swissbib,exclude,exclude_noncommercial_or_quarantined,Non-commercial or quarantined from commercial-safe core.,Unclear,Likely,Likely,Unclear,Likely,Likely,"A Swiss library catalog, with linked data capabilities."
TIND Open APIs,https://docs.tind.io,gemini_vetted,TIND Open APIs,exclude,software_api_framework,"TIND Open APIs are platform tooling, not a coherent source row.",Varies,Maybe,Yes,Varies,Maybe,Yes,API access to a growing number of spin-off institutional repositories; useful for identifying small-scale academic presses and local institutional awards.
Transparency International Linked Data,https://transparency.org,deepseek,Transparency International Linked Data,exclude,exclude_noncommercial_or_quarantined,Non-commercial or quarantined from commercial-safe core.,Unclear,Likely,Likely,Unclear,Likely,Likely,Corruption Perceptions Index and Sources data published as Linked Data.
Virtuoso,https://virtuoso.openlinksw.com,deepseek,Virtuoso,exclude,exclude_category_error,Tooling / framework / vocabulary rather than a source row.,Unclear,Likely,Likely,Unclear,Likely,Likely,A universal server that provides a SPARQL endpoint and linked data capabilities.
VuFind Discovery APIs,https://vufind.org,gemini_vetted,VuFind Discovery APIs,exclude,software_api_framework,"VuFind is discovery software, not a coherent source dataset.",Varies,Yes,Yes,Varies,Yes,Yes,Highly prevalent open-source discovery layer; exposes structured bibliographic data for institutions running underlying Koha or Kuali OLE implementations.
YASGUI,https://yasgui.triply.cc,deepseek,YASGUI,exclude,exclude_category_error,Tooling / framework / vocabulary rather than a source row.,Unclear,Likely,Likely,Unclear,Likely,Likely,"Yet Another SPARQL GUI, a popular web-based SPARQL query editor."
ZDB,https://zdb-katalog.de,deepseek,ZDB,exclude,exclude_noncommercial_or_quarantined,Non-commercial or quarantined from commercial-safe core.,Unclear,Likely,Likely,Unclear,Likely,Likely,"A German union catalog of serials, with linked data potential."
Zenodo,https://zenodo.org,deepseek,Zenodo,exclude,exclude_category_error,"Generic repository or registry, not a direct source row.",Varies,Likely,Likely,Varies,Likely,Likely,"A general-purpose open-access repository that hosts many linked data datasets, including literary awards."
re3data,https://www.re3data.org,deepseek,re3data,exclude,exclude_category_error,Tooling / framework / vocabulary rather than a source row.,Unclear,Likely,Likely,Unclear,Likely,Likely,"A registry of research data repositories, with linked data potential."
